{
  "schema_version": "1.1",
  "event_id": "c3d4e5f6-a7b8-9012-cdef-123456789012",
  "timestamp": "2026-03-30T10:05:22.456Z",
  "service": {
    "name": "patient-portal",
    "environment": "prod"
  },
  "actor": {
    "subject_id": "user-42",
    "subject_type": "human",
    "org_id": "org-100",
    "roles": ["viewer"]
  },
  "action": {
    "type": "READ",
    "data_classification": "PHI"
  },
  "resource": {
    "type": "ClinicalNote",
    "id": "note-555",
    "patient_id": "patient-200"
  },
  "outcome": {
    "status": "DENIED",
    "error_type": "RoleDenied",
    "error_message": "Role 'viewer' lacks read access to ClinicalNote"
  }
}
